{
  "schema_version": "1.0.0",
  "result_id": "VER-20261024T161715Z-FF81DA01",
  "project": "repo",
  "revision": "sha256:dc691bdb1a814bceac7f245ba0c43f8e6c3e069a1739360d3edc100740a3fbd3",
  "dirty": false,
  "tier": "verify",
  "command": ".assurance/tools/verify (run_verifier.py --tier verify)",
  "started_at": "2026-10-24T16:17:15.051403Z",
  "completed_at": "2026-10-24T16:17:15.624477Z",
  "runner": {
    "identity": "local:Saturnine",
    "environment": "host",
    "os": "windows-11",
    "architecture": "AMD64",
    "network_policy": "denied (declared; not enforced on the host)"
  },
  "profile": {
    "version": "0.2.0",
    "digest": "sha256:30e210ebd8b0c402c3d0b6353a7d4f910a89e3a1ccb2860965fb423d73d354b3"
  },
  "catalog": {
    "version": "1.1.0",
    "digest": "sha256:db5dca08fc879796558d957bea207b0a66e16be4386cb9dafed1c68a35dccfa7"
  },
  "status": "pass",
  "checks": [
    {
      "id": "gofmt",
      "control_ids": [
        "VER-001",
        "VER-003"
      ],
      "command": "gofmt -l .",
      "tool": {
        "id": "gofmt",
        "version": "go version go1.26.4 windows/amd64",
        "digest": "not-applicable:unpinned-local-tool"
      },
      "started_at": "2026-10-24T16:17:15.051418Z",
      "completed_at": "2026-10-24T16:17:15.100713Z",
      "status": "pass",
      "blocking": true,
      "attempts": 1,
      "evidence": [],
      "limitations": []
    },
    {
      "id": "go-vet",
      "control_ids": [
        "VER-001",
        "VER-003"
      ],
      "command": "go vet ./...",
      "tool": {
        "id": "go",
        "version": "go version go1.26.4 windows/amd64",
        "digest": "not-applicable:unpinned-local-tool"
      },
      "started_at": "2026-10-24T16:17:15.100747Z",
      "completed_at": "2026-10-24T16:17:15.363408Z",
      "status": "pass",
      "blocking": true,
      "attempts": 1,
      "evidence": [],
      "limitations": []
    },
    {
      "id": "go-test",
      "control_ids": [
        "ENG-002",
        "VER-001",
        "VER-003"
      ],
      "command": "go test ./...",
      "tool": {
        "id": "go",
        "version": "go version go1.26.4 windows/amd64",
        "digest": "not-applicable:unpinned-local-tool"
      },
      "started_at": "2026-10-24T16:17:15.363431Z",
      "completed_at": "2026-10-24T16:17:15.624412Z",
      "status": "pass",
      "blocking": true,
      "attempts": 1,
      "evidence": [],
      "limitations": []
    }
  ],
  "unrun_checks": [],
  "limitations": [
    "Revision digest is sha256 over Git commit eca6e06bf9fc628714b16f6ba0f81b9a854cb194.",
    "Generated by the general-prompts verifier starter; tools are unpinned until the project records versions and digests."
  ],
  "attachments": []
}
