{
  "schema_version": "1.0.0",
  "result_id": "VER-20261024T161719Z-F8AE6B7E",
  "project": "repo",
  "revision": "sha256:dc21192d4e8906c502bbbcfd4af629a75613055de2053562d3f0889a5dd39f22",
  "dirty": false,
  "tier": "verify-fast",
  "command": ".assurance/tools/verify-fast (run_verifier.py --tier verify-fast)",
  "started_at": "2026-10-24T16:17:18.914291Z",
  "completed_at": "2026-10-24T16:17:19.463809Z",
  "runner": {
    "identity": "local:Saturnine",
    "environment": "host",
    "os": "windows-11",
    "architecture": "AMD64",
    "network_policy": "denied (declared; not enforced on the host)"
  },
  "profile": {
    "version": "0.2.0",
    "digest": "sha256:30e210ebd8b0c402c3d0b6353a7d4f910a89e3a1ccb2860965fb423d73d354b3"
  },
  "catalog": {
    "version": "1.1.0",
    "digest": "sha256:db5dca08fc879796558d957bea207b0a66e16be4386cb9dafed1c68a35dccfa7"
  },
  "status": "pass",
  "checks": [
    {
      "id": "go-vet",
      "control_ids": [
        "VER-001",
        "VER-003"
      ],
      "command": "go vet ./...",
      "tool": {
        "id": "go",
        "version": "go version go1.26.4 windows/amd64",
        "digest": "not-applicable:unpinned-local-tool"
      },
      "started_at": "2026-10-24T16:17:18.914306Z",
      "completed_at": "2026-10-24T16:17:19.192505Z",
      "status": "pass",
      "blocking": true,
      "attempts": 1,
      "evidence": [],
      "limitations": []
    },
    {
      "id": "go-test-short",
      "control_ids": [
        "ENG-002",
        "VER-001",
        "VER-003"
      ],
      "command": "go test -short ./...",
      "tool": {
        "id": "go",
        "version": "go version go1.26.4 windows/amd64",
        "digest": "not-applicable:unpinned-local-tool"
      },
      "started_at": "2026-10-24T16:17:19.192540Z",
      "completed_at": "2026-10-24T16:17:19.463739Z",
      "status": "pass",
      "blocking": true,
      "attempts": 1,
      "evidence": [],
      "limitations": []
    }
  ],
  "unrun_checks": [],
  "limitations": [
    "Revision digest is sha256 over Git commit 9248a45aa970f247cc8818926e34d7af80092945.",
    "Generated by the general-prompts verifier starter; tools are unpinned until the project records versions and digests."
  ],
  "attachments": []
}
