{
  "schema_version": "1.1.0",
  "result_id": "VER-20261024T163038Z-CA331AA3",
  "project": "repo",
  "revision": "sha256:ef4c14fcb3344ab6af7068a6c4127a3136143d290cc447f64a84f9b3c5331985",
  "dirty": false,
  "tier": "verify",
  "command": ".assurance/tools/verify (run_verifier.py --tier verify)",
  "started_at": "2026-10-24T16:30:37.308266Z",
  "completed_at": "2026-10-24T16:30:38.550970Z",
  "runner": {
    "identity": "local:Saturnine",
    "environment": "host",
    "os": "windows-11",
    "architecture": "AMD64",
    "network_policy": "denied (declared; not enforced on the host)"
  },
  "profile": {
    "version": "0.2.0",
    "digest": "sha256:2bb810fcbdd9eeb6b4a2d56c86889b99d0a4699ebbfc0b3377a7c8a01ed9bfdc"
  },
  "catalog": {
    "version": "1.1.0",
    "digest": "sha256:db5dca08fc879796558d957bea207b0a66e16be4386cb9dafed1c68a35dccfa7"
  },
  "status": "pass",
  "checks": [
    {
      "id": "gofmt",
      "control_ids": [
        "VER-001",
        "VER-003"
      ],
      "command": "gofmt -l .",
      "tool": {
        "id": "gofmt",
        "version": "go version go1.26.4 windows/amd64",
        "digest": "not-applicable:unpinned-local-tool"
      },
      "started_at": "2026-10-24T16:30:37.308289Z",
      "completed_at": "2026-10-24T16:30:37.508295Z",
      "status": "pass",
      "blocking": true,
      "attempts": 1,
      "evidence": [],
      "limitations": []
    },
    {
      "id": "go-vet",
      "control_ids": [
        "VER-001",
        "VER-003"
      ],
      "command": "go vet ./...",
      "tool": {
        "id": "go",
        "version": "go version go1.26.4 windows/amd64",
        "digest": "not-applicable:unpinned-local-tool"
      },
      "started_at": "2026-10-24T16:30:37.508349Z",
      "completed_at": "2026-10-24T16:30:38.007778Z",
      "status": "pass",
      "blocking": true,
      "attempts": 1,
      "evidence": [],
      "limitations": []
    },
    {
      "id": "go-test",
      "control_ids": [
        "ENG-002",
        "VER-001",
        "VER-003"
      ],
      "command": "go test ./...",
      "tool": {
        "id": "go",
        "version": "go version go1.26.4 windows/amd64",
        "digest": "not-applicable:unpinned-local-tool"
      },
      "started_at": "2026-10-24T16:30:38.008253Z",
      "completed_at": "2026-10-24T16:30:38.550795Z",
      "status": "pass",
      "blocking": true,
      "attempts": 1,
      "evidence": [],
      "limitations": []
    }
  ],
  "unrun_checks": [],
  "limitations": [
    "Revision digest is sha256 over Git commit 8d5951ab35e43350635e725934c058984dd43c8e.",
    "Generated by the general-prompts verifier starter; tools are unpinned until the project records versions and digests."
  ],
  "attachments": [],
  "sentinels": [
    {
      "name": "secret patterns in changed files",
      "kind": "secret_findings",
      "comparison": "equals",
      "expected": 0,
      "observed": 0,
      "outcome": "pass"
    },
    {
      "name": "writes outside the work item's filesystem scope",
      "kind": "writes_outside_declared_paths",
      "comparison": "equals",
      "expected": 0,
      "observed": 0,
      "outcome": "pass"
    }
  ]
}
