{
  "schema_version": "1.0.0",
  "result_id": "VER-20261024T175141Z-AC5327E1",
  "project": "repo",
  "revision": "sha256:5096588e936116d27f7d1823b8ea4aea72c6267dcf1162b99e29dbb086527c21",
  "dirty": false,
  "tier": "verify",
  "command": ".assurance/tools/verify (run_verifier.py --tier verify)",
  "started_at": "2026-10-24T17:51:32.059933Z",
  "completed_at": "2026-10-24T17:51:41.126386Z",
  "runner": {
    "identity": "local:449c347b1df7",
    "environment": "host",
    "os": "linux-6.18.33.2-microsoft-standard-wsl2",
    "architecture": "x86_64",
    "network_policy": "denied (declared; not enforced on the host)"
  },
  "profile": {
    "version": "0.2.0",
    "digest": "sha256:f1234808c0320f04e1503683510086cef99f8bc1413434e2c34c432e86acd80d"
  },
  "catalog": {
    "version": "1.1.0",
    "digest": "sha256:db5dca08fc879796558d957bea207b0a66e16be4386cb9dafed1c68a35dccfa7"
  },
  "status": "pass",
  "checks": [
    {
      "id": "gofmt",
      "control_ids": [
        "VER-001",
        "VER-003"
      ],
      "command": "gofmt -l .",
      "tool": {
        "id": "gofmt",
        "version": "go version go1.26.10 linux/amd64",
        "digest": "not-applicable:unpinned-local-tool"
      },
      "started_at": "2026-10-24T17:51:32.059970Z",
      "completed_at": "2026-10-24T17:51:32.070339Z",
      "status": "pass",
      "blocking": true,
      "attempts": 1,
      "evidence": [],
      "limitations": []
    },
    {
      "id": "go-vet",
      "control_ids": [
        "VER-001",
        "VER-003"
      ],
      "command": "go vet ./...",
      "tool": {
        "id": "go",
        "version": "go version go1.26.10 linux/amd64",
        "digest": "not-applicable:unpinned-local-tool"
      },
      "started_at": "2026-10-24T17:51:32.070367Z",
      "completed_at": "2026-10-24T17:51:38.227978Z",
      "status": "pass",
      "blocking": true,
      "attempts": 1,
      "evidence": [],
      "limitations": []
    },
    {
      "id": "go-test",
      "control_ids": [
        "ENG-002",
        "VER-001",
        "VER-003"
      ],
      "command": "go test ./...",
      "tool": {
        "id": "go",
        "version": "go version go1.26.10 linux/amd64",
        "digest": "not-applicable:unpinned-local-tool"
      },
      "started_at": "2026-10-24T17:51:38.228007Z",
      "completed_at": "2026-10-24T17:51:41.126308Z",
      "status": "pass",
      "blocking": true,
      "attempts": 1,
      "evidence": [],
      "limitations": []
    }
  ],
  "unrun_checks": [],
  "limitations": [
    "Revision digest is sha256 over Git commit 7f9e06bf0b7caabfbdd294d3d295c0d816cb0ca9.",
    "Generated by the general-prompts verifier starter; tools are unpinned until the project records versions and digests."
  ],
  "attachments": []
}
