{
  "schema_version": "1.0.0",
  "result_id": "VER-20261024T181428Z-A31B62BE",
  "project": "repo",
  "revision": "sha256:fe938cc4825ad454e201792775715ba4d52a51bdeb40a00d91aeaf62971e12f8",
  "dirty": false,
  "tier": "verify-fast",
  "command": ".assurance/tools/verify-fast (run_verifier.py --tier verify-fast)",
  "started_at": "2026-10-24T18:14:17.704923Z",
  "completed_at": "2026-10-24T18:14:28.541114Z",
  "runner": {
    "identity": "local:5a322b0f7711",
    "environment": "host",
    "os": "linux-6.18.33.2-microsoft-standard-wsl2",
    "architecture": "x86_64",
    "network_policy": "denied (declared; not enforced on the host)"
  },
  "profile": {
    "version": "0.2.0",
    "digest": "sha256:f1234808c0320f04e1503683510086cef99f8bc1413434e2c34c432e86acd80d"
  },
  "catalog": {
    "version": "1.1.0",
    "digest": "sha256:db5dca08fc879796558d957bea207b0a66e16be4386cb9dafed1c68a35dccfa7"
  },
  "status": "pass",
  "checks": [
    {
      "id": "go-vet",
      "control_ids": [
        "VER-001",
        "VER-003"
      ],
      "command": "go vet ./...",
      "tool": {
        "id": "go",
        "version": "go version go1.26.10 linux/amd64",
        "digest": "not-applicable:unpinned-local-tool"
      },
      "started_at": "2026-10-24T18:14:17.704954Z",
      "completed_at": "2026-10-24T18:14:24.304844Z",
      "status": "pass",
      "blocking": true,
      "attempts": 1,
      "evidence": [],
      "limitations": []
    },
    {
      "id": "go-test-short",
      "control_ids": [
        "ENG-002",
        "VER-001",
        "VER-003"
      ],
      "command": "go test -short ./...",
      "tool": {
        "id": "go",
        "version": "go version go1.26.10 linux/amd64",
        "digest": "not-applicable:unpinned-local-tool"
      },
      "started_at": "2026-10-24T18:14:24.304874Z",
      "completed_at": "2026-10-24T18:14:28.541033Z",
      "status": "pass",
      "blocking": true,
      "attempts": 1,
      "evidence": [],
      "limitations": []
    }
  ],
  "unrun_checks": [],
  "limitations": [
    "Revision digest is sha256 over Git commit f43677687e99f28cac52a7fa452225abec944990.",
    "Generated by the general-prompts verifier starter; tools are unpinned until the project records versions and digests."
  ],
  "attachments": []
}
